{"failed_trials":0,"manifest":{"artifact_id":"art_018f3e20-0000-7000-8000-0000000001f9","byte_length":1583,"classification":"restricted","content_digest":"sha256:7ac2493ea6967851fb22c8f92b0d37b3988777c4897ce4685f75d0b1c28e18e4","display_name":null,"media_type":"application/json"},"missing_trials":2,"parent_run_id":"run_018f3e20-0000-7000-8000-000000000208","schema_version":1,"scored_trials":0,"trials":[{"evidence":{"kind":"missing","reason":"not_started"},"expected":{"artifact_id":"art_018f3e20-0000-7000-8000-0000000001f6","byte_length":46,"classification":"restricted","content_digest":"sha256:d22da177fcbb3abb7191529a0d8ac7fe7f0f80b54a18d46ff66b805eef176e68","display_name":null,"media_type":"application/json"},"input":{"artifact_id":"art_018f3e20-0000-7000-8000-0000000001f5","byte_length":46,"classification":"restricted","content_digest":"sha256:d22da177fcbb3abb7191529a0d8ac7fe7f0f80b54a18d46ff66b805eef176e68","display_name":null,"media_type":"application/json"},"trial":{"manifest_digest":"sha256:7ac2493ea6967851fb22c8f92b0d37b3988777c4897ce4685f75d0b1c28e18e4","repetition":0,"sample_id":"one","trial_digest":"sha256:3c3f099e14eddcdd536f4c0d61977f7b8f3c42e6243b94aebd446eecb3ef9b60"}},{"evidence":{"kind":"missing","reason":"not_started"},"expected":{"artifact_id":"art_018f3e20-0000-7000-8000-0000000001f6","byte_length":46,"classification":"restricted","content_digest":"sha256:d22da177fcbb3abb7191529a0d8ac7fe7f0f80b54a18d46ff66b805eef176e68","display_name":null,"media_type":"application/json"},"input":{"artifact_id":"art_018f3e20-0000-7000-8000-0000000001f5","byte_length":46,"classification":"restricted","content_digest":"sha256:d22da177fcbb3abb7191529a0d8ac7fe7f0f80b54a18d46ff66b805eef176e68","display_name":null,"media_type":"application/json"},"trial":{"manifest_digest":"sha256:7ac2493ea6967851fb22c8f92b0d37b3988777c4897ce4685f75d0b1c28e18e4","repetition":1,"sample_id":"one","trial_digest":"sha256:3f04bcaf512e5011363913e8d59e9a86f568f84829cf4c8ff8b0729da40d9598"}}]}